title,author,description,genres,ratings,number of ratings,number of reviews,5 star,4 star,3 star,2 star,1 star
The Nowhere Man,Gregg Andrew Hurwitz,"He was once called Orphan X.As a boy, Evan Smoak was taken from a children's home, raised and trained as part of a secret government initiative buried so deep that virtually no one knows it exists. But he broke with the programme, choosing instead to vanish off grid and use his formidable skill set to help those unable to protect themselves.Ambushed, drugged, and spirited away, Evan wakes up in a locked room with no idea where he is or who has captured him. As he tries to piece together what's happened, testing his gilded prison and its highly trained guards for weaknesses, he receives a desperate call for help.With time running out, he will need to out-think, out-manoeuvre, and out-fight an opponent the likes of whom he's never encountered to have any chance of escape. He's got to save himself to protect those whose lives depend on him. Or die trying . . .","['Thriller', 'Fiction', 'Mystery', 'Action', 'Suspense', 'Crime', 'Mystery Thriller', 'Audiobook', 'Adventure', 'Contemporary']",4.14,"25,659 ratings","2,202 reviews","9,769","10,784","4,228",701,177
The Virgins of Venice,Gina Buonaguro,"In sixteenth-century Venice, one young noblewoman dares to resist the choices made for herVenice in 1509 is on the brink of war. The displeasure of Pope Julius II is a continuing threat to the republic, as is the barely contained fighting in the countryside. Amid this turmoil, noblewoman Justina Soranzo, just sixteen, hopes to make a rare love marriage with her sweetheart, Luca Cicogna. Her hopes are dashed when her father decides her younger sister, Rosa, will marry in a strategic alliance and Justina will be sent to the San Zaccaria convent, in the tradition of aristocratic daughters. Lord Soranzo is not acting only to protect his family. It’s well known that he is in debt to both his trading partners and the most infamous courtesan in the city, La Diamante, and the pressure is closing in.After arriving at the convent, Justina takes solace in her aunt Livia, one of the nuns, and in the growing knowledge that all is not strictly devout at San Zaccaria. Justina is shocked to discover how the women of the convent find their own freedom in what seems to her like a prison. But secrets and scandals breach the convent walls, and Justina learns there may be even worse fates for her than the veil, if La Diamante makes good on her threats.Desperate to protect herself and the ones she loves, Justina turns to Luca for help. She finds she must trust her own heart to make the impossible decisions that may save or ruin them all.","['Historical Fiction', 'Fiction', 'Historical', 'Italy', 'Epic', 'Contemporary', 'Drama', 'Romance', 'Italian Literature', 'Medieval']",4.28,"6,201 ratings",68 reviews,"2,835","2,667",348,277,74
The Lightning Thief,Rick Riordan,"Alternate cover for this ISBN can be found herePercy Jackson is a good kid, but he can't seem to focus on his schoolwork or control his temper. And lately, being away at boarding school is only getting worse - Percy could have sworn his pre-algebra teacher turned into a monster and tried to kill him. When Percy's mom finds out, she knows it's time that he knew the truth about where he came from, and that he go to the one place he'll be safe. She sends Percy to Camp Half Blood, a summer camp for demigods (on Long Island), where he learns that the father he never knew is Poseidon, God of the Sea. Soon a mystery unfolds and together with his friends—one a satyr and the other the demigod daughter of Athena - Percy sets out on a quest across the United States to reach the gates of the Underworld (located in a recording studio in Hollywood) and prevent a catastrophic war between the gods.","['Fantasy', 'Young Adult', 'Mythology', 'Fiction', 'Middle Grade', 'Adventure', 'Greek Mythology', 'Childrens', 'Urban Fantasy', 'Audiobook']",4.30,"2,851,661 ratings","92,938 reviews","1,489,376","870,686","380,032","78,525","33,042"
Gone Girl,Gillian Flynn,"This is an alternate cover edition for ISBN 9780307588371Who are you?What have we done to each other?These are the questions Nick Dunne finds himself asking on the morning of his fifth wedding anniversary when his wife Amy suddenly disappears. The police suspect Nick. Amy's friends reveal that she was afraid of him, that she kept secrets from him. He swears it isn't true. A police examination of his computer shows strange searches. He says they weren't made by him. And then there are the persistent calls on his mobile phone.So what did happen to Nick's beautiful wife?","['Fiction', 'Mystery', 'Thriller', 'Mystery Thriller', 'Crime', 'Suspense', 'Contemporary', 'Adult', 'Audiobook', 'Adult Fiction']",4.13,"2,994,051 ratings","151,817 reviews","1,285,852","1,064,903","449,919","123,679","69,698"
Winnie-the-Pooh,A.A. Milne,"The adventures of Christopher Robin and his friends in which Pooh Bear uses a balloon to get honey, Piglet meets a Heffalump, and Eeyore has a birthday.","['Childrens', 'Fiction', 'Classics', 'Fantasy', 'Animals', 'Middle Grade', 'Audiobook', 'Picture Books', 'Young Adult', 'Juvenile']",4.35,"321,961 ratings","6,862 reviews","184,834","85,201","38,342","8,528","5,056"
Pericles and Aspasia: A Story of Ancient Greece,Yvonne Korshak,"STEP ASIDE, ANTONY AND PERICLES AND ASPASIA —THE LOVE STORY THAT SHAPED HISTORYTwo lovers crest the wave of the golden age of Pericles, statesman and general, and Aspasia, his courtesan, a philosopher's daughter, and a brilliant woman in her own right. In a world of hierarchies, he is at the top when she arrives as little more than flotsam cast up on Athenian shores. Their love transcends social sanctions, enduring and deepening despite the grave threat it presents to Pericles' reputation as a leader of the Athenian democracy.The novel unfolds against the background of the arts and history of the Golden Age, seen through the eyes of two individuals who lent their particular brilliance to make it ""golden"": Pericles, the great orator and visionary of democracy, and its most influential woman, Aspasia. Their story takes them from the Agora-Athens' marketplace to the Acropolis, from the raunchy Athenian Port Piraeus mercantile across the Aegean Sea to East Greece. Pericles and Aspasia—together and apart—navigate treacherous paths from venal calculations to impassioned philosophical inquiry, from high-stakes sea battles to the passions of family life.Pericles and Aspasia engages issues that are vital today—the paradoxes of democracy, the tensions of hierarchy, the ironies of gender, and others—but this novel is immersed in classical the city, its sunshine, its physical presence, its people, and their struggles and aspirations.",[],4.33,"3,955 ratings",31 reviews,"1,858","1,769",153,123,52
Night Owl,Andrew Mayne,"A shocking act of sabotage draws a retired spy into a deadly conspiracy in an explosive thriller by an Amazon Charts and Wall Street Journal bestselling author.After three decades in counterintelligence, Brad Trasker is retired, disillusioned, and dealing with a tragic loss. Spy games are behind him until he attends the launch of a next-generation aircraft. When the project of innovative aerospace CEO Kylie Connor explodes on the tarmac―nearly killing her in the process―Trasker is pulled back into the line of fire.The mystery of the sabotage quickly deepens. All Kylie’s data has been wiped from the server. One of her engineers has disappeared. A seed investor has died in a suspicious car accident. And a cold-blooded murder raises the stakes even higher.To discover who’s pulling the strings behind a dangerous conspiracy, Trasker needs to find a motive. Corporate espionage, revenge, or something he can’t yet see? Targeted by assassins, he finds himself overmatched when he realizes he can’t trust anyone―including Kylie. Too long out of a game he no longer understands, Trasker must adapt or die.","['Thriller', 'Mystery', 'Fiction', 'Mystery Thriller', 'Suspense', 'Espionage', 'Crime', 'Audiobook', 'Conspiracy Theories', 'Spy Thriller']",4.19,"5,575 ratings",251 reviews,"2,490","1,959",893,189,44
Black Fire,William Kely McClung,"Major Tommy Black is at the crossroads of a brilliant, clandestine career. Lost... without purpose or mission. His life in sealed records and whispered stories of his violent exploits. Devastated and blaming himself when a member of his covert task force commits suicide, but when the man’s daughter is kidnapped, Black, the man with “a talent for violence,” sacrifices all for the nearly impossible chance to save the girl... and maybe his soul.For fans of Robert Ludlum and Lee Child, BLACK FIRE is a “tour de force of explosive action” that takes the reader on an epic, breathtaking adventure from the exotic Indian Ocean island of Mauritius to the remote interior of South Africa and across Europe into the towering mountains of Central Asia, and introduces a riveting new hero to cheer along with Reacher and Bourne — Tommy Black.",[],4.31,"4,815 ratings",33 reviews,"2,249","2,092",243,162,69
The Grapes of Wrath,John Steinbeck,"The Pulitzer Prize-winning epic of the Great Depression, a book that galvanized—and sometimes outraged—millions of readers.First published in 1939, Steinbeck’s Pulitzer Prize-winning epic of the Great Depression chronicles the Dust Bowl migration of the 1930s and tells the story of one Oklahoma farm family, the Joads—driven from their homestead and forced to travel west to the promised land of California. Out of their trials and their repeated collisions against the hard realities of an America divided into Haves and Have-Nots evolves a drama that is intensely human yet majestic in its scale and moral vision, elemental yet plainspoken, tragic but ultimately stirring in its human dignity. A portrait of the conflict between the powerful and the powerless, of one man’s fierce reaction to injustice, and of one woman’s stoical strength, the novel captures the horrors of the Great Depression and probes into the very nature of equality and justice in America. At once a naturalistic epic, captivity narrative, road novel, and transcendental gospel, Steinbeck’s powerful landmark novel is perhaps the most American of American Classics.","['Classics', 'Fiction', 'Historical Fiction', 'Literature', 'Novels', 'School', 'American', 'Historical', 'Classic Literature', 'High School']",4.00,"889,336 ratings","23,244 reviews","373,445","271,679","152,353","57,763","34,096"
Dark State,Jack Slater,"If you come after the CIA’s most feared assassin, there’s one cardinal rule: Don’t miss.America is under attack. Thousands lie dead after simultaneous strikes across the country. The day will come to be known as Bloody Monday.Jason Trapp, codename ‘Hangman’, was a covert operative whose feats became the stuff of legend. He was the tip of the spear—the man his country unleashed when all hope was lost.Six months ago, someone sold him out. The Agency listed him as killed in action. He lost everything—and everyone—he held dear.But Trapp’s not that easy to kill. As his country reels from the deadliest terrorist attacks it has ever witnessed, Trapp’s personal vendetta leads him right back to where he started: duty to his country. The violence, the terror, the assassination of his partner… It’s all connected.And now the Hangman is coming for the guilty.⎯⎯⎯⎯⎯⎯⎯⎯⎯⎯⎯⎯⎯⎯⎯⎯⎯⎯⎯⎯⎯⎯⎯⎯⎯⎯⎯⎯⎯⎯⎯⎯⎯⎯⎯⎯""Fans of Ryan, Reacher and Bourne will love betrayed CIA operative Jason Trapp, who stars in a pulse-pounding revenge thriller in 2019's breakout hit.""Note: Dark State was previously published as Deep State.",[],4.43,"10,074 ratings",462 reviews,"5,781","3,164",870,166,93
The Sacred Well Murders,Susan Rowland,"A simple job turns deadly when Mary Wandwalker, novice detective, is hired to chaperone a young American, Rhiannon, to the Oxford University Summer School on the ancient Celts. Worried by a rhetoric of blood sacrifice, Mary and her operatives, Caroline, and Anna, attend a sacrifice at a sacred well. They discover that those who fail to individuate their gods become possessed by them.For the so-called Reborn Celts, who run the summer school, have been infiltrated by white supremacists. Could their immersion in myth be less a symbol for psychic wholeness and more a clue of their intent to engage in terrorist violence? Who better to penetrate their secret rites than an apparently harmless woman of a certain age?Mary agrees to spy on the Reborn Celts, then learns, to her horror, of Anna's passionate affair with the chief suspect, Joe Griffith. With Griffith also the object of Rhiannon's obsession, Mary realizes too late that that these 21 st century Celts mean murder.The Reborn Celts draw Mary and her friends into three rites to summon their at an Oxford sacred well, by the Thames on the way to London, and in Celtic London, where bloodshed will restore one of the Thames' 'lost rivers.'Before the fatal night of the summer solstice, Caroline and Anna race to London seeking Mary, who has been kidnapped. Will she end as the crone sacrifice? Or will the three women re-make their detecting family, so re-constituting a pattern of archetypal feminine compassion?",[],4.31,"6,268 ratings",25 reviews,"2,883","2,776",327,,
The World According to Garp,John Irving,"This is the life and times of T. S. Garp, the bastard son of Jenny Fields—a feminist leader ahead of her times. This is the life and death of a famous mother and her almost-famous son; theirs is a world of sexual extremes—even of sexual assassinations. It is a novel rich with ""lunacy and sorrow""; yet the dark, violent events of the story do not undermine a comedy both ribald and robust. In more than thirty languages, in more than forty countries—with more than ten million copies in print—this novel provides almost cheerful, even hilarious evidence of its famous last line: ""In the world according to Garp, we are all terminal cases.""","['Fiction', 'Classics', 'Literature', 'Contemporary', 'Novels', 'Literary Fiction', 'Humor', 'American', 'Adult Fiction', 'Drama']",4.10,"226,202 ratings","6,645 reviews","90,373","84,815","38,061","9,321","3,632"
