title,author,description,genres,ratings,number of ratings,number of reviews,5 star,4 star,3 star,2 star,1 star
Harry Potter and the Sorcerer’s Stone,J.K. Rowling,"An alternative cover for this ASIN can be found here""Turning the envelope over, his hand trembling, Harry saw a purple wax seal bearing a coat of arms; a lion, an eagle, a badger and a snake surrounding a large letter 'H'.""Harry Potter has never even heard of Hogwarts when the letters start dropping on the doormat at number four, Privet Drive. Addressed in green ink on yellowish parchment with a purple seal, they are swiftly confiscated by his grisly aunt and uncle. Then, on Harry's eleventh birthday, a great beetle-eyed giant of a man called Rubeus Hagrid bursts in with some astonishing news: Harry Potter is a wizard, and he has a place at Hogwarts School of Witchcraft and Wizardry. An incredible adventure is about to begin!","['Fiction', 'Young Adult', 'Magic', 'Childrens', 'Middle Grade', 'Classics', 'Audiobook', 'Adventure', 'Science Fiction Fantasy', 'Novels']",4.47,"9,702,221 ratings","156,485 reviews","6,283,997","2,242,052","822,059","188,351","165,762"
Charlie and the Chocolate Factory,Roald Dahl,Charlie Bucket's wonderful adventure begins when he finds one of Mr. Willy Wonka's precious Golden Tickets and wins a whole day inside the mysterious chocolate factory. Little does he know the surprises that are in store for him!(back cover),"['Fiction', 'Fantasy', 'Childrens', 'Classics', 'Young Adult', 'Middle Grade', 'Humor', 'Adventure', 'Juvenile', 'Novels']",4.16,"827,273 ratings","15,823 reviews","364,222","281,056","141,583","27,849","12,563"
The Princess Bride,William Goldman,"What happens when the most beautiful girl in the world marries the handsomest prince of all time and he turns out to be...well...a lot less than the man of her dreams?As a boy, William Goldman claims, he loved to hear his father read the S. Morgenstern classic, The Princess Bride. But as a grown-up he discovered that the boring parts were left out of good old Dad's recitation, and only the ""good parts"" reached his ears.Now Goldman does Dad one better. He's reconstructed the ""Good Parts Version"" to delight wise kids and wide-eyed grownups everywhere.What's it about? Fencing. Fighting. True Love. Strong Hate. Harsh Revenge. A Few Giants. Lots of Bad Men. Lots of Good Men. Five or Six Beautiful Women. Beasties Monstrous and Gentle. Some Swell Escapes and Captures. Death, Lies, Truth, Miracles, and a Little Sex.In short, it's about everything.","['Fantasy', 'Classics', 'Fiction', 'Romance', 'Humor', 'Young Adult', 'Adventure', 'Comedy', 'Science Fiction Fantasy', 'Fairy Tales']",4.27,"888,521 ratings","25,339 reviews","463,312","261,708","116,999","29,215","17,287"
Interview with the Vampire,Anne Rice,"This is the story of Louis, as told in his own words, of his journey through mortal and immortal life. Louis recounts how he became a vampire at the hands of the radiant and sinister Lestat and how he became indoctrinated, unwillingly, into the vampire way of life. His story ebbs and flows through the streets of New Orleans, defining crucial moments such as his discovery of the exquisite lost young child Claudia, wanting not to hurt but to comfort her with the last breaths of humanity he has inside. Yet, he makes Claudia a vampire, trapping her womanly passion, will, and intelligence inside the body of a small child. Louis and Claudia form a seemingly unbreakable alliance and even ""settle down"" for a while in the opulent French Quarter. Louis remembers Claudia's struggle to understand herself and the hatred they both have for Lestat that sends them halfway across the world to seek others of their kind. Louis and Claudia are desperate to find somewhere they belong, to find others who understand, and someone who knows what and why they are.Louis and Claudia travel Europe, eventually coming to Paris and the ragingly successful Theatre des Vampires--a theatre of vampires pretending to be mortals pretending to be vampires. Here they meet the magnetic and ethereal Armand, who brings them into a whole society of vampires. But Louis and Claudia find that finding others like themselves provides no easy answers and in fact presents dangers they scarcely imagined.Originally begun as a short story, the book took off as Anne wrote it, spinning the tragic and triumphant life experiences of a soul. As well as the struggles of its characters, Interview captures the political and social changes of two continents. The novel also introduces Lestat, Anne's most enduring character, a heady mixture of attraction and revulsion. The book, full of lush description, centers on the themes of immortality, change, loss, sexuality, and power.source: annerice.com","['Horror', 'Fantasy', 'Fiction', 'Vampires', 'Paranormal', 'Classics', 'Gothic', 'Supernatural', 'Historical Fiction', 'Urban Fantasy']",4.02,"576,775 ratings","15,532 reviews","219,916","198,807","116,405","30,826","10,821"
Fight Club,Chuck Palahniuk,"Chuck Palahniuk showed himself to be his generation’s most visionary satirist in this, his first book. Fight Club’s estranged narrator leaves his lackluster job when he comes under the thrall of Tyler Durden, an enigmatic young man who holds secret after-hours boxing matches in the basement of bars. There, two men fight ""as long as they have to."" This is a gloriously original work that exposes the darkness at the core of our modern world.","['Fiction', 'Classics', 'Thriller', 'Novels', 'Mystery', 'Adult', 'Literature', 'Contemporary', 'American', 'Adult Fiction']",4.19,"580,699 ratings","20,826 reviews","257,385","208,914","87,453","19,625","7,322"
The Wonderful Wizard of Oz,L. Frank Baum,"Come along, Toto, she said. We will go to the Emerald City and ask the Great Oz how to get back to Kansas again.Swept away from her home in Kansas by a tornado, Dorothy and her dog Toto find themselves stranded in the fantastical Land of Oz. As instructed by the Good Witch of the North and the Munchkins, Dorothy sets off on the yellow brick road to try and find her way to the Emerald City and the Wizard of Oz, who can help her get home. With her companions the Scarecrow, the Tin Woodman and the Cowardly Lion, Dorothy experiences an adventure full of friendship, magic and danger. A much-loved children's classic, The Wizard of Oz continues to delight readers young and old with its enchanting tale of witches, flying monkeys and silver shoes.","['Fantasy', 'Fiction', 'Childrens', 'Classics', 'Young Adult', 'Adventure', 'Middle Grade', 'Audiobook', 'Literature', 'Magic']",4.00,"445,405 ratings","16,862 reviews","164,462","152,253","99,075","21,602","8,013"
The Three Musketeers,Alexandre Dumas,"Le roman raconte les aventures d'un Gascon impécunieux de 18 ans, d'Artagnan, venu à Paris pour faire carrière dans le corps des mousquetaires. Il se lie d'amitié avec Athos, Porthos et Aramis, mousquetaires du roi Louis XIII. Ces quatre hommes vont s'opposer au premier ministre, le cardinal de Richelieu et à ses agents, dont le comte de Rochefort et la belle et mystérieuse Milady de Winter, pour sauver l'honneur de la reine de France Anne d'Autriche. Avec ses nombreux combats et ses rebondissements romanesques, Les Trois Mousquetaires est l'exemple type du roman de cape et d'épée et le succès du roman a été tel que Dumas l'a adapté lui-même au théâtre, et a repris les quatre héros dans la suite de la trilogie","['Classics', 'Fiction', 'Historical Fiction', 'Adventure', 'France', 'Literature', 'Historical', 'French Literature', 'Classic Literature', 'Novels']",4.09,"317,196 ratings","9,168 reviews","123,036","117,481","62,020","11,425","3,234"
Emma,Jane Austen,"The newest edition is here. Another alternate cover can be found here.Emma Woodhouse is one of Austen's most captivating and vivid characters. Beautiful, spoilt, vain and irrepressibly witty, Emma organizes the lives of the inhabitants of her sleepy little village and plays matchmaker with devastating effect.","['Classics', 'Fiction', 'Romance', 'Historical Fiction', 'Literature', 'Historical', 'Audiobook', '19th Century', 'Classic Literature', 'Novels']",4.04,"860,320 ratings","31,139 reviews","334,662","304,744","162,994","40,367","17,553"
Oliver Twist,Charles Dickens,"A gripping portrayal of London's dark criminal underbelly, published in Penguin Classics with an introduction by Philip Horne.The story of Oliver Twist - orphaned, and set upon by evil and adversity from his first breath - shocked readers when it was published. After running away from the workhouse and pompous beadle Mr Bumble, Oliver finds himself lured into a den of thieves peopled by vivid and memorable characters - the Artful Dodger, vicious burglar Bill Sikes, his dog Bull's Eye, and prostitute Nancy, all watched over by cunning master-thief Fagin. Combining elements of Gothic Romance, the Newgate Novel and popular melodrama, Dickens created an entirely new kind of fiction, scathing in its indictment of a cruel society, and pervaded by an unforgettable sense of threat and mystery.This Penguin Classics edition of Oliver Twist is the first critical edition to faithfully reproduce the text as its earliest readers would have encountered it from its serialisation in Bentley's Miscellany, and includes an introduction by Philip Horne, a glossary of Victorian thieves' slang, a chronology of Dickens's life, a map of contemporary London and all of George Cruikshank's original illustrations.For more than seventy years, Penguin has been the leading publisher of classic literature in the English-speaking world. With more than 1,700 titles, Penguin Classics represents a global bookshelf of the best works throughout history and across genres and disciplines. Readers trust the series to provide authoritative texts enhanced by introductions and notes by distinguished scholars and contemporary authors, as well as up-to-date translations by award-winning translators.","['Classics', 'Fiction', 'Historical Fiction', 'Literature', 'Novels', '19th Century', 'Classic Literature', 'Victorian', 'Historical', 'British Literature']",3.88,"381,231 ratings","10,357 reviews","113,750","143,704","94,307","22,223","7,247"
A Prayer for Owen Meany,John Irving,"Eleven-year-old Owen Meany, playing in a Little League baseball game in Gravesend, New Hampshire, hits a foul ball and kills his best friend's mother. Owen doesn't believe in accidents; he believes he is God's instrument. What happens to Owen after that 1953 foul is both extraordinary and terrifying. At moments a comic, self-deluded victim, but in the end the principal, tragic actor in a divine plan, Owen Meany is the most heartbreaking hero John Irving has yet created.","['Fiction', 'Classics', 'Contemporary', 'Literature', 'Literary Fiction', 'Novels', 'Historical Fiction', 'Coming Of Age', 'Adult Fiction', 'American']",4.24,"317,295 ratings","16,110 reviews","159,851","97,103","42,294","12,185","5,862"
Rebecca,Daphne du Maurier,"""Last night I dreamt I went to Manderley again...""Ancient, beautiful Manderley, between the rose garden and the sea, is the county's showpiece. Rebecca made it so - even a year after her death, Rebecca's influence still rules there. How can Maxim de Winter's shy new bride ever fill her place or escape her vital shadow?A shadow that grows longer and darker as the brief summer fades, until, in a moment of climatic revelations, it threatens to eclipse Manderley and its inhabitants completely...","['Fiction', 'Mystery', 'Gothic', 'Romance', 'Classics', 'Historical Fiction', 'Thriller', 'Horror', 'Mystery Thriller', 'Audiobook']",4.24,"612,464 ratings","38,626 reviews","291,826","209,909","84,556","18,763","7,410"
Persuasion,Jane Austen,"Persuasion is Jane Austen's last completed novel. She began it soon after she had finished Emma, completing it in August 1816. She died, aged 41, in 1817; Persuasion was published in December that year (but dated 1818). Persuasion is linked to Northanger Abbey not only by the fact that the two books were originally bound up in one volume and published together, but also because both stories are set partly in Bath, a fashionable city with which Austen was well acquainted, having lived there from 1801 to 1805. Besides the theme of persuasion, the novel evokes other topics, such as the Royal Navy, in which two of Jane Austen's brothers ultimately rose to the rank of admiral. As in Northanger Abbey, the superficial social life of Bath-well known to Austen, who spent several relatively unhappy and unproductive years there-is portrayed extensively and serves as a setting for the second half of the book. In many respects Persuasion marks a break with Austen's previous works, both in the more biting, even irritable satire directed at some of the novel's characters and in the regretful, resigned outlook of its otherwise admirable heroine, Anne Elliot, in the first part of the story. Against this is set the energy and appeal of the Royal Navy, which symbolises for Anne and the reader the possibility of a more outgoing, engaged, and fulfilling life, and it is this worldview which triumphs for the most part at the end of the novel.","['Classics', 'Fiction', 'Romance', 'Historical Fiction', 'Historical', 'Literature', 'Audiobook', '19th Century', 'Historical Romance', 'Classic Literature']",4.15,"682,624 ratings","31,428 reviews","302,602","227,353","115,833","25,462","11,374"
Bridge to Terabithia,Katherine Paterson,"The 40th anniversary edition of the classic Newbery Medal-winning title by beloved author Katherine Paterson, with brand-new bonus materials including an author's note by Katherine herself and a foreword by New York Times bestselling author Kate DiCamillo.Jess Aarons has been practicing all summer so he can be the fastest runner in the fifth grade. And he almost is, until the new girl in school, Leslie Burke, outpaces him. The two become fast friends and spend most days in the woods behind Leslie's house, where they invent an enchanted land called Terabithia. One morning, Leslie goes to Terabithia without Jess and a tragedy occurs. It will take the love of his family and the strength that Leslie has given him for Jess to be able to deal with his grief.was also named an ALA Notable Children’s Book and has become a touchstone of children’s literature, as have many of Katherine Paterson’s other novels, including and .","['Fiction', 'Young Adult', 'Classics', 'Fantasy', 'Childrens', 'Middle Grade', 'Realistic Fiction', 'School', 'Contemporary', 'Banned Books']",4.04,"535,313 ratings","15,949 reviews","215,320","178,874","101,254","27,436","12,429"
A Game of Thrones,George R.R. Martin,"Long ago, in a time forgotten, a preternatural event threw the seasons out of balance. In a land where summers can last decades and winters a lifetime, trouble is brewing. The cold is returning, and in the frozen wastes to the north of Winterfell, sinister forces are massing beyond the kingdom’s protective Wall. To the south, the king’s powers are failing—his most trusted adviser dead under mysterious circumstances and his enemies emerging from the shadows of the throne. At the center of the conflict lie the Starks of Winterfell, a family as harsh and unyielding as the frozen land they were born to. Now Lord Eddard Stark is reluctantly summoned to serve as the king’s new Hand, an appointment that threatens to sunder not only his family but the kingdom itself.Sweeping from a harsh land of cold to a summertime kingdom of epicurean plenty, tells a tale of lords and ladies, soldiers and sorcerers, assassins and bastards, who come together in a time of grim omens. Here an enigmatic band of warriors bear swords of no human metal; a tribe of fierce wildlings carry men off into madness; a cruel young dragon prince barters his sister to win back his throne; a child is lost in the twilight between life and death; and a determined woman undertakes a treacherous journey to protect all she holds dear. Amid plots and counter-plots, tragedy and betrayal, victory and terror, allies and enemies, the fate of the Starks hangs perilously in the balance, as each side endeavors to win that deadliest of conflicts: the game of thrones.","['Fantasy', 'Fiction', 'Epic Fantasy', 'High Fantasy', 'Adult', 'Science Fiction Fantasy', 'Adventure', 'Audiobook', 'Dragons', 'Novels']",4.44,"2,434,783 ratings","62,423 reviews","1,493,985","655,642","192,843","51,619","40,694"
Perfume: The Story of a Murderer,Patrick Süskind,"An acclaimed bestseller and international sensation, Patrick Suskind's classic novel provokes a terrifying examination of what happens when one man's indulgence in his greatest passion—his sense of smell—leads to murder.In the slums of eighteenth-century France, the infant Jean-Baptiste Grenouille is born with one sublime gift—an absolute sense of smell. As a boy, he lives to decipher the odors of Paris, and apprentices himself to a prominent perfumer who teaches him the ancient art of mixing precious oils and herbs. But Grenouille's genius is such that he is not satisfied to stop there, and he becomes obsessed with capturing the smells of objects such as brass doorknobs and fresh-cut wood. Then one day he catches a hint of a scent that will drive him on an ever-more-terrifying quest to create the ""ultimate perfume""—the scent of a beautiful young virgin. Told with dazzling narrative brilliance, is a hauntingly powerful tale of murder and sensual depravity.","['Fiction', 'Classics', 'Historical Fiction', 'Horror', 'Mystery', 'Thriller', 'Crime', 'Historical', 'German Literature', 'Novels']",4.03,"452,821 ratings","23,666 reviews","176,765","160,669","80,278","24,648","10,461"
The Secret Garden,Frances Hodgson Burnett,"In a house full of sadness and secrets, can young, orphaned Mary find happiness?Mary Lennox, a spoiled, ill-tempered, and unhealthy child, comes to live with her reclusive uncle in Misselthwaite Manor on England’s Yorkshire moors after the death of her parents. There she meets a hearty housekeeper and her spirited brother, a dour gardener, a cheerful robin, and her wilful, hysterical, and sickly cousin, Master Colin, whose wails she hears echoing through the house at night.With the help of the robin, Mary finds the door to a secret garden, neglected and hidden for years. When she decides to restore the garden in secret, the story becomes a charming journey into the places of the heart, where faith restores health, flowers refresh the spirit, and the magic of the garden, coming to life anew, brings health to Colin and happiness to Mary.","['Classics', 'Fiction', 'Childrens', 'Young Adult', 'Historical Fiction', 'Middle Grade', 'Fantasy', 'Audiobook', 'Historical', 'Literature']",4.15,"1,138,183 ratings","27,417 reviews","499,825","385,866","195,648","41,054","15,790"
The Asset,Saul Herzog,"Montana, USAWhen Lance Spector quit the CIA, he swore he was out for good. One more government lie and he would go off the deep end. They could find someone else to do their dirty work. As far as he was concerned, Washington, Langley, the Pentagon could all go to hell.Yekaterinburg, RussiaA secret Russian expedition returns with a devastating new pathogen, harvested from the frozen corpses of mammoths. It's the biological super weapon they've been looking for, an apocalypse-level pathogen, a virus more deadly than anything ever to come out of a Russian lab. Something that will stop NATO and the Americans in their tracks.A Biological Chernobyl.Washington DC, USAA mysterious vial, sealed in a titanium case, arrives at CIA headquarters. They have no idea who sent it, but it comes with a note.""I will only speak to Lance Spector.""",[],4.29,"9,458 ratings",326 reviews,"4,703","3,279","1,106",248,122
Catching Fire,Suzanne Collins,"Sparks are igniting.Flames are spreading.And the Capitol wants revenge.Against all odds, Katniss Everdeen has won the Hunger Games. She and fellow District 12 tribute Peeta Mellark are miraculously still alive. Katniss should be relieved, happy even. After all, she has returned to her family and her longtime friend, Gale. Yet nothing is the way Katniss wishes it to be. Gale holds her at an icy distance. Peeta has turned his back on her completely. And there are whispers of a rebellion against the Capitol—a rebellion that Katniss and Peeta may have helped create.Much to her shock, Katniss has fueled an unrest that she's afraid she cannot stop. And what scares her even more is that she's not entirely convinced she should try. As time draws near for Katniss and Peeta to visit the districts on the Capitol's cruel Victory Tour, the stakes are higher than ever. If they can't prove, without a shadow of a doubt, that they are lost in their love for each other, the consequences will be horrifying.In , the second novel of the Hunger Games trilogy, Suzanne Collins continues the story of Katniss Everdeen, testing her more than ever before . . . and surprising readers at every turn.","['Young Adult', 'Dystopia', 'Fiction', 'Fantasy', 'Science Fiction', 'Romance', 'Teen', 'Audiobook', 'Post Apocalyptic', 'Action']",4.32,"3,429,693 ratings","119,593 reviews","1,753,147","1,145,220","429,126","79,334","22,866"
Scavenger Hunt,Chad Boudreaux,"WHEN JUSTICE IS BLIND, SCAVENGERS DO THE HUNTINGBlake Hudson just wants to serve his country well as a lawyer for the United States Justice Department—but when an unknown threat begins plotting his downfall, he must find who is setting him up before it costs him his life.Scavenger Hunt is a suspense novel chronicling the plight of Blake Hudson, a Justice Department lawyer assigned to a clandestine counterterrorist group created to bypass onerous legal requirements. After the group mysteriously disbands, Hudson becomes the scapegoat and is transformed from hunter to hunted. As he searches for answers and attempts to piece the puzzle together, people are following him, trying to kill him.Written for fans of fast-paced thrillers, dry humor, political gamesmanship, and Clue-like twists and turns, Scavenger Hunt carves out a distinct niche best described as a hybrid of the Robert Ludlum classics and works by Brad Meltzer. Blake Hudson’s story addresses issues that have shaped recent elections and continue to frustrate interest groups and government leaders, while featuring the inner workings of the U.S. Department of Justice Building—arguably the most important and misunderstood agency in the federal government. Author Chad Boudreaux’s unique voice and page-turning storytelling packs a plot-driven punch that readers won’t be able to put down.",[],4.31,"6,196 ratings",36 reviews,"2,882","2,763",243,188,120
How It Unfolds,James S.A. Corey,"An astronaut’s interstellar mission is a personal journey of a thousand second chances in an exhilarating short story by James S. A. Corey, the New York Times bestselling author of The Expanse series.Roy Court and his crew are taking the trip of a lifetime—several lifetimes in fact—duplicated and dispatched across the galaxies searching for Earthlike planets. Many possibilities for the future. Yet for Roy, no matter how many of him there are, there’s still just one painful, unchangeable past. In what world can a broken relationship be reborn? The universe is so vast, there’s always room for hope.James S. A. Corey’s How It Unfolds is part of The Far Reaches, a collection of science-fiction stories that stretch the imagination and open the heart. They can be read or listened to in one sitting.","['Science Fiction', 'Short Stories', 'Fiction', 'Audiobook', 'Space', 'Novella', 'Science Fiction Fantasy', 'Space Opera', 'Speculative Fiction', 'Fantasy']",4.02,"6,924 ratings",432 reviews,"2,357","2,736","1,483",283,65
The Handmaid’s Tale,Margaret Atwood,"Offred is a Handmaid in the Republic of Gilead. She may leave the home of the Commander and his wife once a day to walk to food markets whose signs are now pictures instead of words because women are no longer allowed to read. She must lie on her back once a month and pray that the Commander makes her pregnant, because in an age of declining births, Offred and the other Handmaids are valued only if their ovaries are viable. Offred can remember the years before, when she lived and made love with her husband, Luke; when she played with and protected her daughter; when she had a job, money of her own, and access to knowledge. But all of that is gone now…Funny, unexpected, horrifying, and altogether convincing, is at once scathing satire, dire warning, and tour de force.","['Fiction', 'Classics', 'Dystopia', 'Science Fiction', 'Feminism', 'Fantasy', 'Adult', 'Audiobook', 'Literature', 'Novels']",4.13,"1,980,401 ratings","93,720 reviews","853,135","700,289","303,565","83,139","40,273"
Invisible Monsters,Chuck Palahniuk,"She's a catwalk model who has everything: a boyfriend, a career, a loyal best friend. But when a sudden motor 'accident' leaves her disfigured and incapable of speech, she goes from being the beautiful centre of attention to being an invisible monster, so hideous that no one will acknowledge she exists.Enter Brandy Alexander, Queen Supreme, one operation away from being a real woman, who will teach her that reinventing yourself means erasing your past and making up something better, and that salvation hides in the last place you'll ever want to look.The narrator must exact revenge upon Evie, her best friend and fellow model; kidnap Manus, her two-timing ex-boyfriend; and hit the road with Brandy in search of a brand-new past, present and future.","['Fiction', 'Contemporary', 'Thriller', 'Horror', 'Novels', 'Humor', 'Mystery', 'Adult', 'Dark', 'Adult Fiction']",4.00,"141,506 ratings","6,906 reviews","52,200","50,009","28,479","8,115","2,703"
